{
  "mapping_version": "wiki-to-runtime/v0.2",
  "generated_at_bucket": "2026-05-23",
  "source_delta_batch_hash": "bundle-sha256:sample-source-delta-batch-v0.2-batch1",
  "mappings": [
    {
      "mapping_id": "map-rw-writing-continuity-core",
      "mapping_version": "wiki-to-runtime/v0.2",
      "reviewed_wiki_id": "rw-writing-continuity-core",
      "reviewed_wiki_hash": "sha256:sample-reviewed-wiki-writing-continuity-core",
      "wiki_type": "writing_continuity_rule",
      "runtime_targets": [
        "writing_rule_packs",
        "scene_mappings",
        "kb_context_summary",
        "negative_constraints"
      ],
      "scene_type_ids": [
        "hot_blood_battle",
        "urban_fantasy"
      ],
      "kb_actions": [
        "expand_story",
        "rewrite_story",
        "accept_story_body",
        "create_story_task"
      ],
      "rule_group": "writing_group",
      "runtime_rule_pack_ids": [
        "wg-continuity-core"
      ],
      "selected_kb_rule_ids": [
        "rule:writing-continuity-core"
      ],
      "summary_fragment_ids": [
        "summary:continuity-first"
      ],
      "negative_constraint_ids": [
        "negative:no-fact-rewrite",
        "negative:no-raw-kb"
      ],
      "target_field_paths": [
        "writing_rule_packs[].directives",
        "scene_mappings.*.kb_context_summary",
        "negative_constraints[]"
      ],
      "duration_targets": [],
      "failure_pattern_ids": [],
      "repair_mapping_ids": [],
      "future_qa_ids": [],
      "sanitized_fragment_hashes": [
        "sha256:summary-continuity-first"
      ],
      "fallback_behavior": "supporting_rule",
      "reviewed_at_bucket": "2026-05-23",
      "runtime_eligible_reason": "Core story continuity rule required before storyboard planning.",
      "blocked_reason": "",
      "coverage_status": "covered",
      "review_status": "reviewed",
      "effective_confidence": "medium",
      "runtime_eligible": true,
      "leakage_count": 0
    },
    {
      "mapping_id": "map-rw-scene-expression-visible-action",
      "mapping_version": "wiki-to-runtime/v0.2",
      "reviewed_wiki_id": "rw-scene-expression-visible-action",
      "reviewed_wiki_hash": "sha256:sample-reviewed-wiki-scene-expression-visible-action",
      "wiki_type": "scene_expression_rule",
      "runtime_targets": [
        "writing_rule_packs",
        "director_rule_packs",
        "scene_mappings",
        "action_results"
      ],
      "scene_type_ids": [
        "hot_blood_battle",
        "urban_fantasy"
      ],
      "kb_actions": [
        "expand_story",
        "rewrite_story",
        "create_story_task",
        "generate_storyboard"
      ],
      "rule_group": "writing_group",
      "runtime_rule_pack_ids": [
        "wg-scene-expression-visible-action",
        "dg-director-scheduling-core"
      ],
      "selected_kb_rule_ids": [
        "rule:scene-expression-visible-action"
      ],
      "summary_fragment_ids": [
        "summary:visible-action-scene-expression"
      ],
      "negative_constraint_ids": [
        "negative:no-abstract-mood-only"
      ],
      "target_field_paths": [
        "writing_rule_packs[].directives",
        "director_rule_packs[].directives",
        "scene_mappings.*.scene_profile",
        "action_results[]"
      ],
      "duration_targets": [],
      "failure_pattern_ids": [],
      "repair_mapping_ids": [],
      "future_qa_ids": [],
      "sanitized_fragment_hashes": [
        "sha256:summary-visible-action-scene-expression"
      ],
      "fallback_behavior": "supporting_rule",
      "reviewed_at_bucket": "2026-05-23",
      "runtime_eligible_reason": "Visible action is required to convert story material into storyboard tasks.",
      "blocked_reason": "",
      "coverage_status": "covered",
      "review_status": "reviewed",
      "effective_confidence": "medium",
      "runtime_eligible": true,
      "leakage_count": 0
    },
    {
      "mapping_id": "map-rw-director-scheduling-core",
      "mapping_version": "wiki-to-runtime/v0.2",
      "reviewed_wiki_id": "rw-director-scheduling-core",
      "reviewed_wiki_hash": "sha256:sample-reviewed-wiki-director-scheduling-core",
      "wiki_type": "director_scheduling_rule",
      "runtime_targets": [
        "director_rule_packs",
        "scene_mappings",
        "selected_kb_rules",
        "kb_context_summary"
      ],
      "scene_type_ids": [
        "hot_blood_battle",
        "urban_fantasy"
      ],
      "kb_actions": [
        "create_story_task",
        "generate_storyboard",
        "repair_storyboard"
      ],
      "rule_group": "director_group",
      "runtime_rule_pack_ids": [
        "dg-director-scheduling-core"
      ],
      "selected_kb_rule_ids": [
        "rule:director-scheduling-core"
      ],
      "summary_fragment_ids": [
        "summary:director-handoff"
      ],
      "negative_constraint_ids": [
        "negative:no-director-fact-overwrite"
      ],
      "target_field_paths": [
        "director_rule_packs[].directives",
        "scene_mappings.*.selected_kb_rules",
        "scene_mappings.*.kb_context_summary"
      ],
      "duration_targets": [],
      "failure_pattern_ids": [],
      "repair_mapping_ids": [],
      "future_qa_ids": [],
      "sanitized_fragment_hashes": [
        "sha256:summary-director-handoff"
      ],
      "fallback_behavior": "supporting_rule",
      "reviewed_at_bucket": "2026-05-23",
      "runtime_eligible_reason": "Director scheduling is needed for storyboard task and row structure.",
      "blocked_reason": "",
      "coverage_status": "covered",
      "review_status": "reviewed",
      "effective_confidence": "medium",
      "runtime_eligible": true,
      "leakage_count": 0
    },
    {
      "mapping_id": "map-rw-shot-intent-taxonomy",
      "mapping_version": "wiki-to-runtime/v0.2",
      "reviewed_wiki_id": "rw-shot-intent-taxonomy",
      "reviewed_wiki_hash": "sha256:sample-reviewed-wiki-shot-intent-taxonomy",
      "wiki_type": "shot_language_rule",
      "runtime_targets": [
        "director_rule_packs",
        "scene_mappings",
        "selected_kb_rules"
      ],
      "scene_type_ids": [
        "hot_blood_battle",
        "urban_fantasy"
      ],
      "kb_actions": [
        "create_story_task",
        "generate_storyboard",
        "repair_storyboard"
      ],
      "rule_group": "director_group",
      "runtime_rule_pack_ids": [
        "dg-shot-intent-taxonomy"
      ],
      "selected_kb_rule_ids": [
        "rule:shot-intent-taxonomy"
      ],
      "summary_fragment_ids": [
        "summary:shot-intent-visible-function"
      ],
      "negative_constraint_ids": [
        "negative:no-empty-visible-function"
      ],
      "target_field_paths": [
        "director_rule_packs[].directives",
        "scene_mappings.*.selected_kb_rules"
      ],
      "duration_targets": [],
      "failure_pattern_ids": [],
      "repair_mapping_ids": [],
      "future_qa_ids": [],
      "sanitized_fragment_hashes": [
        "sha256:summary-shot-intent-visible-function"
      ],
      "fallback_behavior": "supporting_rule",
      "reviewed_at_bucket": "2026-05-23",
      "runtime_eligible_reason": "Shot intent taxonomy makes storyboard rows production-usable.",
      "blocked_reason": "",
      "coverage_status": "covered",
      "review_status": "reviewed",
      "effective_confidence": "medium",
      "runtime_eligible": true,
      "leakage_count": 0
    },
    {
      "mapping_id": "map-rw-duration-density-rules",
      "mapping_version": "wiki-to-runtime/v0.2",
      "reviewed_wiki_id": "rw-duration-density-rules",
      "reviewed_wiki_hash": "sha256:sample-reviewed-wiki-duration-density-rules",
      "wiki_type": "shot_language_rule",
      "runtime_targets": [
        "duration_profiles",
        "director_rule_packs",
        "validation_rule_packs",
        "negative_constraints"
      ],
      "scene_type_ids": [
        "hot_blood_battle",
        "urban_fantasy"
      ],
      "kb_actions": [
        "create_story_task",
        "generate_storyboard",
        "validate_result"
      ],
      "rule_group": "director_group",
      "runtime_rule_pack_ids": [
        "dg-duration-density",
        "vg-duration-integrity"
      ],
      "selected_kb_rule_ids": [
        "rule:duration-density"
      ],
      "summary_fragment_ids": [
        "summary:duration-density"
      ],
      "negative_constraint_ids": [
        "negative:no-duration-mismatch",
        "negative:no-zero-duration-row"
      ],
      "target_field_paths": [
        "duration_profiles[]",
        "director_rule_packs[].directives",
        "validation_rule_packs[].directives",
        "coverage_matrix.duration_profile_coverage[]",
        "negative_constraints[]"
      ],
      "duration_targets": [
        5,
        10,
        15,
        30,
        45,
        60
      ],
      "failure_pattern_ids": [
        "failure:duration_allocation_failure"
      ],
      "repair_mapping_ids": [
        "repair:rerun-duration-allocator"
      ],
      "future_qa_ids": [],
      "sanitized_fragment_hashes": [
        "sha256:summary-duration-density"
      ],
      "fallback_behavior": "supporting_rule",
      "reviewed_at_bucket": "2026-05-23",
      "runtime_eligible_reason": "All PWA target durations need shot count and validation coverage.",
      "blocked_reason": "",
      "coverage_status": "covered",
      "review_status": "reviewed",
      "effective_confidence": "medium",
      "runtime_eligible": true,
      "leakage_count": 0
    },
    {
      "mapping_id": "map-rw-prompt-text-boundary",
      "mapping_version": "wiki-to-runtime/v0.2",
      "reviewed_wiki_id": "rw-prompt-text-boundary",
      "reviewed_wiki_hash": "sha256:sample-reviewed-wiki-prompt-text-boundary",
      "wiki_type": "validation_rule",
      "runtime_targets": [
        "director_rule_packs",
        "validation_rule_packs",
        "negative_constraints",
        "action_results"
      ],